2088,В каком канадском городе находится самая высокая в мире телебашня?,Торонто
2089,Каким веком считается начало XX столетия в русской поэзии?,Серебряным
2090,Какое из этих мясных блюд обычно тушат?,Тефтели
2091,Что такое мескаль?,Традиционный мексиканский алкогольный напиток
2092,Кто из этих ребят у Фазиля Искандера был из Чегема?,Сандро
2093,С каким предметом не соревновались гимнастки на Олимпиаде 2012 года?,Скакалка
2094,Какой из этих городов был столицей США?,Филадельфия
2095,"Что означает слово ""кяхта""?",Город
2096,"Назовите множественное число слова ""дно""?",Донья
2097,Какие из этих древних племен не относятся к германским?,Пруссы
2098,Какое из этих морей не входит в бассейн Тихого океана?,Баренцево
2099,Кто из ниже перечисленных был жив на момент окончания Второй Мировой Войны?,Фридрих Паулюс
2100,Как с латинского языка переводится название острова Капри?,«козий остров»
2101,"Какие рыбы были изображены на гербе Царицына, который утвердил Николай I?",Стерляди
2102,Кто является единственным пятикратным чемпионом мира в Формуле-1?,Хуан Мануель Фанхио
2103,Какой из этих живописцев не был портретистом?,Алексей Саврасов
2104,У какого из этих музыкальных инструментов меньше всего струн?,Домбра
2105,"Фраза ""Ешь - потей, работай - мёрзни!"" - это:",Народная мудрость
2106,Каким прибором измеряют силу тока?,Амперметр
2107,Какая фирма пытается изменить нашу жизнь к лучшему?,Phillips
2108,"Кому А.С. Пушкин посвятил стихотворение ""Во глубине сибирских руд...""?",Декабристам
2109,Какое из этих животных доводится самым близким родственником зубру?,Бизон
2110,В каком из этих городов состоялись игры Олимпиады-2000?,Сидней
2111,К какому виду программ относятся компьютерные шахматы?,Симуляторы
2112,Как переводится Буэнос-Айрес?,Xороший воздуx
2113,Какая сказка Пушкина начинается с числительного?,«Сказка о царе Салтане»
2114,"Что делает мастер, зачищая паркет?",циклюет
2115,Кого или что рисуют художники-анималисты?,животных
2116,Из какого мяса делаются традиционные пожарские котлеты?,курятина
2117,"Что можно наблюдать, когда все суетятся?",дым коромыслом
2118,"Какой цвет не входил в самое непонятное цветовое сочетание, да ещё и «в крапинку»?",красный
2119,Какой марки был первый автомобиль Владимира Путина?,"""Запорожец"""
2120,Где в автомобиле находятся форсунки?,В двигателе
2121,"Какой породы был Джим — любимый пёс Василия Качалова, восхитивший Есенина?",Доберман
2122,"У этой болезни много названий: финикийская болезнь, скорбная болезнь, крымка, ленивая смерть. Какая это болезнь?",Проказа
2123,Кто первым совершил в одиночку беспосадочный перелет через Атлантику?,Чарлз Линдберг
2124,"В каком году вышла первая звуковая экранизация трагедии ""Ромео и Джульетта""?",1936
2125,Что из перечисленного не является небесным телом?,самолет
2126,Какой рыцарский орден существует в Великобритании почти триста лет?,орден Бани
2127,"Название какого прибора само говорит, что он лучший?",примус
2128,Из какого материала сделана Венера Милосская?,мрамор
2129,Кто пел дуэтом в фильме «Обыкновенное чудо»?,Эмиль и Эмилия
2130,Какой город расположен не на Ангаре?,Якутск
2131,Какой предмет авангардист Марсель Дюшан выставил как произведение искусства под названием «Фонтан»?,писсуар
2132,За что песенка предлагает шофёру держаться крепче?,за баранку
2133,краткое иносказательное- нравоучительное произведение,аполог
2134,"Хуже чего, как говорят в народе, может надоесть человек?",горькой редьки
2135,Как называется знаменитая советская кинокомедия?,«Джентльмены удачи»
2136,Чем кроют крышу строители?,шифером
2137,В каких единицах химики измеряют количество вещества?,в молях
2138,Какие российские военнослужащие официально имеют в рационе алкоголь?,моряки-подводники
2139,Какой официальный национальный праздник отмечают в Туркмении с 1994 года?,День дыни
2140,"Какой из этих ударов в боксе наносится снизу согнутой рукой, чаще всего в подбородок?",апперкот
2141,"Как называют человека, который утром чувствует себя бодрее, чем вечером?",Жаворонок
2142,"Как в математике называется число, квадрат которого равен ""-1""?",Мнимая единица
2143,Кто из этих сказочных персонажей периодически сносил золотые яйца?,Курочка Ряба
2144,Как звали французского революционера XVIII века Робеспьера?,Максимилиан
2145,Какой актер в трилогии Андре Юнебеля скрывался под маской Фантомаса?,Жан .Маре
2146,Сигнал на российских морских пляжах означает запрет на купание?,Черный шар
2147,Чье имя носит международный конкурс актерской песни?,Андрея Миронова
2148,"Что такое ""ахиллесова пята""?",Уязвимое место
2149,Что оценивают по шкале Бофорта?,Силу ветра
2150,По улице ходила... Кто?(с песенки),Большая крокодила
2151,Как называется серия энциклопедий издательства АСТ?,Я познаю мир
2152,"В какой стране необходимо побывать, чтобы отдохнуть в Анталье?",В Турции
2153,Из какого злака делается пшено?,Просо
2154,Как называется японское искусство аранжировки цветов?,Икебанэ
2155,Что изобрёл в XIX веке англичанин Джордж Стефенсон?,Паровоз
2156,Кто из этих российских хоккеистов не включен в Зал хоккейной славы?,Алексей Ковалёв
2157,"Кем был американец Джозеф Глидден, получивший в 1874 году патент на изобретение колючей проволоки?",фермером
2158,Какого вида акул не существует?,черная
2159,По какому маршруту следует фирменный поезд «Лев Толстой»?,Москва-Хельсинки
2160,"Как назвалась станция, где окончил свою жизнь Лев Толстой?",Астапово
2161,Какими словами в романе А.С.Пушкина начинается письмо Онегина к Татьяне?,"""Предвижу всё ..."""
2162,Какой тип природной зоны можно наблюдать в североамериканской прерии?,Степь
2163,Какой из островов не относится к Курильской гряде?,Монерон
2164,Каким по счету президентом США стал Барак Обама?,44
2165,С чем канцлер Германской империи Отто фон Бисмарк сравнивал колбасу?,С политикой
2166,В какую эпоху обитал питекантроп?,"Считается, что питекантроп обитал в эпоху нижнего палеолита (2,6 млн — 150 тыс. лет до н. э.). Современные исследователи не склонны считать питекантропа предком современного человека. По всей видимомсти он представляет собой дальнюю и изолированную популя"
2167,средство ухода за мебелью,полироль
2168,Назовите высоту вышки в соревнованиях по прыжкам в воду.,10 метров
2169,Какая из перечисленных стран не входит в Еврозону?,Дания
2170,По какой из этих карточных игр регулярно проводятся чемпионаты мира?,Бридж
2171,"Под какой моделью выпускал Генри Форд свой автомобиль ""Форд Лиззи""?",T
2172,Какой титул носит супруг королевы Великобритании Елизаветы II?,Герцог
2173,Кого прозвали рыцарем «без страха и упрёка»?,Пьер Террайль де Баярд
2174,"Какой цвет Андрей Рублев не использовал при написании ""Троицы""?",Красный
2175,Сколько океанов омывает территорию США?,три
2176,Какое настоящее имя Леси Украинки??,Лариса
2177,"Какой из этих драгоценных камней не является, как три остальных, разновидностью берилла?",Хризолит
2178,Кто из этих шахматистов никогда не был чемпионом мира?,В. Корчной
2179,Как часто называют тонкую строганую доску?,вагонка
2180,От какого женского имени происходит уменьшительное имя Нюра?,Анна
2181,"Что должно быть у камня, чтобы его назвали куриным богом?",сквозное отверстие
2182,Где используется индийская защита?,в шахматах
2183,Какой страной не правит монарх?,Португалия
2184,Кто из бесовской четвёрки первым появился на страницах романа «Мастер и Маргарита»?,Коровьев
2185,Что японки до начала ХХ века традиционно делали с зубами для красоты?,чернили
2186,В каком австрийском городе находится аэропорт «Голубой Дунай»?,Линц
2187,"Как называется положение, принимаемое без логического доказательства в силу непосредственной убедительности?",Аксиома
2188,Сколько сонетов образуют венок сонетов?,15
2189,В какой стране денежная единица называется денар?,Македония
2190,"Чему Николай Гоголь посвятил такие строки: «Боже! Как ты хороша подчас! Сколько раз, как погибающий и тонущий, я хватался за тебя, и ты всякий раз меня великодушно выносила и спасала!»",Дороге;
2191,Продолжите знаменитую фразу Гоголя: «Какой же русский не любит быстрой …»?,Езды;
2192,"Что, по мнению Николая Гоголя, является второй (после дураков) бедой России?",Дороги
2193,Как Гоголь определил жанр своего произведения «Мёртвые души»?,Поэма в прозе;
2194,Как заканчивается фраза Н.В. Гоголя: «Чуден Днепр...»?,При тихой погоде;
2195,Как называется повесть Н.В. Гоголя «Ночь перед...»?,Рождеством;
2196,Кого оседлал гоголевский кузнец Вакула?,Чёрта;
2197,Какой памятник был установлен в Санкт-Петербурге?,Носу майора Ковалёва;
2198,Назовите головной убор гоголевского Чичикова?,Картуз;
2199,Что случилось с шинелью Акакия Акакиевича Башмачкина в повести Н.В. Гоголя?,Похитили грабители;
2200,"Где маленький Иван Крылов обучался грамоте, арифметике и молитвам?",Дома;
2201,В каком качестве Иван Андреевич Крылов начал свою литературную деятельность?,Драматурга
2202,Какой литературный псевдоним имел Иван Андреевич Крылов?,Нави Волырк
2203,"В работе над каким произведением А.С. Пушкину очень помогли детские воспоминания баснописца И.А. Крылова, сына боевого офицера?",«Капитанская дочка»
2204,"Как называлось первое произведение Крылова, написанное им в 15 лет?",«Кофейница»
2205,Сколько басен было написано И.А. Крыловым?,Около 200
2206,"Как называлась последняя басня, написанная И.А. Крыловым?",«Вельможа»
2207,За что в 1820 году И.А. Крылов получил орден св. Владимира 4-й степени?,За составление каталога русских книг
2208,Кто автор памятника И.А. Крылову в Летнем саду Санкт-Петербурга?,П.К. Клодт
2209,Сколько басен Ивана Крылова показаны скульптором Клодтом на пьедестале памятника баснописцу в Летнем саду?,Тридцать шесть;
2210,На каком известном памятнике можно увидеть фигуру писателя И.А. Крылова?,«Тысячелетие России»
2211,Каким музыкальным инструментом виртуозно владел баснописец Крылов?,Скрипка
2212,"В день пятидесятилетия творческой деятельности Ивана Андреевича Крылова Пётр Вяземский назвал его так, как до сих пор его называем все мы. Как?",Дедушка Крылов;
2213,Какой из предложенных фразеологизмов пришёл НЕ из басен И.А. Крылова?,Остаться у разбитого корыта;
2214,Без чего не приготовить популярную начинку для шоколадных конфет пралине?,без орехов
2215,Какая из этих звезд находится в созвездии Южного Креста?,Акрукс
2216,Какой из этих воинских чинов не является казачьим?,Ротмистр
2217,Отцом чего называют Норберта Винера?,кибернетики
2218,Кого боится арахнофоб?,Пауков
2219,Чего боится амаксофоб?,Управлять автомобилями
2220,Где проходил чемпионат мира по футболу в 1982 году?,Испания
2221,Чемпион мира по футболу в 1982 году?,Италия
2222,Чемпион мира по футболу 1982 года.,Италия
2223,"Первый в истории футболист, выигравший чемпионат мира в 40 лет.",Дино Дзофф
2224,Лучший бомбардир Лиги Чемпионов,Рауль
2225,Какая из этих стран не входит в Британское содружество?,Таиланд
2226,Кто написал картину «Утро в сосновом лесу»?,Иван Иванович Шишкин и Константин Аполлонович Савицкий (Савицкий написал медведей)
2227,Кто из этих президентов независимых государств не был в советские времена 1-м секретарем ЦК КП соответствующей республики?,А. Акаев
2228,Как быстро скопировать слово и вставить (комбинация клавиш)?,Ctrl+C (копировать) и Ctrl+V (вставить)
2229,Какую «влюблённую парочку» можно увидеть на центральной площади Киева?,фонари
2230,Дата договора между Российской Федерацией и Республикой Крым о принятии в Российскую Федерацию Республики Крым и образовании в составе Российской Федерации новых субъектов,18 марта 2014 года
2231,Какой японский футболист первым сыграл в итальянской Серии А?,Казуйоси Миура
2232,Какой клуб никогда не переходил в итальянскую футбольную Серию В?,"Интернационале, он же Интер (Милан)"
2233,"Какие футбольные клубы, в Испании, по пять раз делали дубль (выигрывали и чемпионат Испании и Кубок Испании)?",«Атлетик Бильбао» и «Барселона»
2234,"В итальянской футбольной Серии А за каждые десять выигранных титулов чемпиона клуб получает право носить небольшую золотую звездочку над эмблемой; таким образом, сколько Ювентус имеет звезд?",три звезды
2235,В каком числе Чемпионатов Мира по футболу Николя Анелька принимал участие?,1
2236,Сколько стадионов принимало игры Кубка Мира по футболу 2010 года в ЮАР?,9
2237,"Что делает рыба, хватая наживку?",клюёт
2238,"Как в СССР называлась организация, созданная на добровольных началах для выдачи её членам беспроцентных ссуд?",касса взаимопомощи
2239,Чего не было у героя известной песни «Вот кто-то с горочки спустился»?,портупеи
2240,Кто из поэтов не снимался в художественных фильмах?,Сергей Есенин
2241,"В 1999 и 2003 году чемпионаты мира по футболу среди женщин проводились в США. Турнир 2003 года должен был проводиться в Китае, однако организаторы приняли решение о переносе. В связи с чем?",В связи с эпидемией атипичной пневмонии в Азии
2242,Как в спорте называется прохождение дистанции гребцами?,заезд
2243,Слюна какой из этих желёз более богата муцином?,подъязычная
2244,Какая страна присоединилась к ЕС в 2007 году?,Болгария
2245,Как по-книжному называется человеконенавистник?,Мизантроп
2246,Какое из этих заболеваний не относится к группе прионных болезней?,Сап
2247,"Что из этих ""зарослей"" является также названием большого серого дрозда?",Рябинник
2248,Какой из биологических ядов является самым сильным?,Токсин ботулизма
2249,"Первый финал чемпионата Европы по футболу между СССР и Югославией прошедший в Париже в 1960 году, закончился в дополнительное время со счётом 2:1. Кто забил победный гол?",Виктор Владимирович Понедельник
2250,"Первый финал чемпионата Европы по футболу между СССР и Югославией прошедший в Париже в 1960 году, закончился в дополнительное время со счётом 2:1. Кто забил второй гол в этом матче?",Слава Калистратович Метревели
2251,"Сколько команд побеждавших на чемпионате Европы по футболу, добивались этого в качестве хозяев турнира?",3
2252,"Сборные из числа выигрывавших чемпионат Европы по футболу, но не добивавшиеся успеха на своей родной земле",Германия и Нидерланды
2253,"Чемпион Европы по футболу, победивший в следствии правила «золотого гола»","Германия (1996, в матче с Чехией, со счётом 2:1), Франция (2000, в матче с Италией, со счётом 2:1)"
2254,"Какая часть отсутствует в кинотрилогии Кништофа Кислевского ""Три цвета""?",зеленый
2255,Что такое антрацит?,уголь
2256,Какие звуки издаёт мода?,Писк.
2257,"Какой вес камня, в игре кёрлинг (в фунтах)?",44
2258,"Какой вес камня, в игре кёрлинг (в килограммах)?","19,96"
2259,Чем вооружен каждый из игроков в кёрлинг?,щеткой
2260,"Какой футбольной команде удалось выиграть Лигу Чемпионов 2005 года, завершив половину матча со счётом 3-0, но сравнять счёт, забив 3 гола во втором тайме и потом забив 3 решающих гола (пенальти) в серии пенальти, победить в игре против ФК Милан?",Ливерпуль
