1,В какую из этих игр играют не клюшкой?,Бильярд
2,В каком городе не работал великий композитор 18-го века Кристоф Виллибальд Глюк?,Берлин
3,Кто первым доказал периодичность появления комет?,Галлей
4,"Про какую летнюю погоду говорят ""Вёдро"" ?",Сухая ясная
5,Сколько человек находится одновременно на площадке при игре в пляжный волейбол?,Четыре
6,С какой из этих стран Чехия не граничит?,Венгрия
7,Где в основном проживают таты?,Дагестан
8,"Как, в переводе на русский язык, звучало бы название фильма 'Мимино'?",Сокол
9,"Как называется курс парусного судна, совпадающий с направлением ветра?",Фордевинд
10,"На вершине какой горы расположена сорокаметровая статуя Христа, являющаяся символом Рио-де-Жанейро?",Корковадо
11,"Какое брюхо, согласно спорной русской пословице, глухо к ученью?",Сытое
12,Благодаря какому животному Шурик познакомился с Ниной в к/ф 'Кавказская пленница'?,Осел
13,Что из этого является видом ткани?,Креп-жоржет
14,Как называется комедия В. В. Маяковского?,Клоп
15,Кто является чемпионом гонок 'Формулы-1' 1998-99 г.г.?,Хаккинен
16,Чье произведение легло в основу оперы Дж. Верди 'Травиата'?,А.Дюма-сына
17,Какой из этих городов - родина Казановы?,Венеция
18,Кто считается основоположником кубизма?,П. Пикассо
19,Территория какой из этих стран - наибольшая?,Япония
20,Какая из этих кислот является витамином?,Никотиновая
21,Какая очередность этих трех букв в русском алфавите правильная?,Ъ Ы Ь
22,Какая березка стояла во поле?,Кудрявая
23,Кто из этих знаменитых людей не является тезкой остальных?,Лужков
24,Какой ресторан находится на углу Старого и Нового Арбата?,Прага
25,Какой вид березы славится красивой древесиной?,Карельская
26,Какая поэма есть у В. В. Маяковского?,"""Флейта-позвоночник"""
27,Какая из этих рек впадает в Азовское море?,Дон
28,Кто из этих великих футболистов прошлого был защитником?,Беккенбауэр
29,Какую икру больше всего любил Джеймс Бонд?,Белужью
30,"Какой цвет волос был у возлюбленной Тристана Изольды, если верить Бедье?",Белокурый
31,У автомобилей какой из этих стран международный регистрационный знак DZ?,Алжир
32,Одним из направлений какой религиозной философии является учение дзен?,Буддизм
33,В каком городе в 1932 году был проведён первый международный кинофестиваль? ,Венеция
34,С какой фигуры начинаются соревнования по городошному спорту?,Пушка
35,Сколько раз в сутки подзаводят часы на Спасской башне московского Кремля?,Два
36,Кто получил первую Нобелевскую премию по литературе?,Поэт
37,"С какой буквы начинаются слова, опубликованные в 16 м томе последнего издания Большой Советской энциклопедии?",М
38,Кто из перечисленных был пажом во времена Екатерины II?,А. Н. Радищев
39,Какой химический элемент был назван в честь злого подземного гнома? ,Кобальт
40,"Как назвали первую кимберлитовую трубку, открытую Ларисой Попугаевой 21 августа 1954 года?",«Зарница»
41,В честь какого растения область Фриули-Венеция-Джулия в Италии ежегодно проводит трёхмесячный фестиваль?,спаржа
42,"Как ""в народе"" называют химическое соединение - тринитротолуол?",Тротил
43,"У кого из ""вампиров"" кровь пьют только самки?",Комары
44,В каком российском городе к его 300-летию был открыт памятник Зайцу?,Санкт-Петербург
45,Для чего зайцу его большие уши?,"Они как рупоры, зайцу слышны даже самые тихие шорохи"
46,Что обычно охотники замечают за зайцем?,Он барабанит
47,Что при травле зайца кричали охотники?,«Ату!»
48,Какого зайца НЕ бывает?,Чувак
49,Кто такой агути?,Горбатый заяц
50,Заячьей картошкой в народе называют:,Гриб дождевик
51,"В русских сказках лисичка-сестричка, коза-дереза, а зайчик-... Кто?",Побегайчик
52,Какая российская автономия полностью окружена Краснодарским краем?,Адыгея
53,"Где жил старик со своею старухой из сказки А.С. Пушкина ""Сказка о рыбаке и рыбке""?",в землянке
54,"Какой рыболовной снастью ловил рыбу старик из сказки А.С. Пушкина ""Сказка о рыбаке и рыбке""?",Невод
55,"За какую плату работал Балда у попа в сказке А.С. Пушкина ""Сказка о попе и работнике его Балде""?",Три щелчка по лбу
56,Кто такая Арина Радионовна?,Няня Пушкина
57,"Сколько лет рыбачил старик из сказки А.С.Пушкина ""Сказка о рыбаке и рыбке""?",33
58,"Какую позицию на поле называют ""голкипер""?",Вратарь
59,Официальный язык государства Израиль?,Иврит
60,Как называется детеныш норки?,Щенок
61,В артериях кровь движется...?,От сердца к органам
62,От какого дерева появляются желуди?,Дуб
63,Где муха-цокотуха нашла денежку?,В поле
64,"Как звали крысу в сказке ""Золотой ключик""?",Шушара
65,Маленький мук из сказки был...?,Карликом
66,"Чем промышлял Дуремар из сказки ""Золотой ключик""?",Пиявками
67,Где сидит Доктор Айболит?,Под деревом
68,Что такое обувница?,Предмет мебели для обуви
69,Корюшка - это...,Рыбка
70,В какое море впадает Жёлтая река?,Жёлтое море
71,Кто был главным врагом трех поросят?,Волк
72,"Какая планета совершает 1 оборот вокруг солнца со скоростью 47,9 км/с",Меркурий
73,Какого города нет в Казахстане?,Самарканд
74,Кем по образованию был Антон Павлович Чехов?,Врач
75,Какой из театров Москвы носит имя А.П. Чехова?,МХАТ (МХТ)
76,Как звали тонкого в рассказе А.П. Чехова «Толстый и тонкий»?,Порфирий
77,Кому из обитателей палаты №6 в одноименном рассказе А.П.Чехова разрешалось выходить из флигеля и больничного двора на улицу?,Моисейке
78,Сестры с каким именем не было среди героинь чеховских «Трёх сестёр»?,Анна
79,Какой из этих литературных шедевров с четвероногими героями принадлежит перу А.П. Чехова?,«Каштанка»
80,Рассказ А.П.Чехова о несчастном ревматике.,Сапоги
81,В какой пьесе А.П. Чехова герой обращался к шкафу с эпитетом «многоуважаемый»?,«Вишневый сад»
82,В каком итальянском городе была выведена известная порода комнатных собак?,Болонья
83,Какая рыба является самым крупным пресноводным хищником?,Cом
84,В какую из этих женщин был влюблён И.С.Тургенев?,Полина Виардо
85,Президент какой республики в 1996 году был избран президентом ФИДЕ?,Калмыкии
86,Как звали младшего сына легендарного комдива Василия Ивановича Чапаева?,Аркадий
87,Чему равна сумма чисел от 0 до 100 включительно?,5050
88,Какой буквой физики обозначают ускорение свободного падения?,g
89,Кто из этих российских императоров и императриц правил раньше остальных?,Анна Иоановна
90,Как называл народ медную монету в 3 копейки после 40 годов XIX века?,Гривенный
91,На борту какого линкора ВМФ США был подписан акт о капитуляции Японии во второй мировой войне?,"""Миссури"""
92,"Из произведений какого писателя физики заимствовали слово ""кварк""?",Джеймс Джойс
93,Какой европейский город раньше носил название Лютеция?,Париж
94,"Сенатором какого штата был Ал Гор до того, как стал вице-президентом США?",Теннесси
95,В какие годы строился Колизей?,72-80
96,Изобретатель тачки?,Паскаль
97,"Назовите греческого атлета, выигравшего марафон на Первой Олимпиаде нашего времени.",Луис
98,"Кого из российских правителей называли ""русским Гамлетом""     ",Павел
99,Что из перечисленного является единственным колониальным владением Британии в Европе?,Гибралтар
100,Облик какой женщины дошёл до наших дней благодаря скульптору Тутмесу?,Нефертити
101,"Кто из этих известных актеров и режиссеров, народных артистов СССР, стал министром культуры своей страны?",Богдан Ступка
102,Кто из этих людей не был писателем ?  A: Во B: Ге C: Ле D: По ,Ге
103,Кто стал самым молодым маршалом Советского Союза в истории СССР?  ,М.Н.Тухачевский
104,Какой из этих городов до воссоединения Германии был в составе ГДР?  A: Трир B: ВейБрауншвейгмар C:  D: Ганновер ,Веймар
105,Как назывался первый атомный ледокол СССР?,Ленин
106,В какой стране на население наводили ужас тонтон-макуты?,Гаити
107,Как называлась столица государства ацтеков?,Теночтитлан
108,Назовите административный центр (столицу) штата Флорида,Таллахасси
109,Какое российское флотское звание было у Витуса Беринга?,Капитан-командор
110,Что означает количество пятнышек у божьей коровки?,Вид
111,Какая пара этих знаменитых писателей состоит из родных братьев?  ,Генрих и Томас Манны
112,Кому и в какой глаз впился князь Гвидон в образе комара?,Поварихе в правыйихе в правый
113,"Игроков какой команды называют ""армейцами""","""ЦСКА"""
114,К какому семейству рыб принадлежит пескарь?,Карповые
115,Кто из этих астрономов 1 ноября 1977 года открыл Хирон - малую планету Солнечной системы?,Чарльз Коуэл
116,Кто из этих русских писателей прожил самую долгую жизнь?,И. А. Бунин
117,"При введении в России табели о рангах право на личное дворянство имели даже чиновники низшего, 14-го класса. А с какого класса это право сохранилось после 1845 г.?",9
118,Какой советский орден был инкрустирован бриллиантами?,Орден Победы
119,Под каким названием всему миру была известна разведслужба бывшей ГДР?,ШТАЗИ
120,Сказочный Доктор?,Айболит
121,Куда отправляет Военкомат?,Служить
122,Во время исторического полёта Юрий Гагарин был одет в костюм «СК-1». Что обозначают эти буквы?,Скафандр космонафта
123,Сколько циферблатов у курантов Спасской башни?,4
124,"Что было изображено на торте, который в начале войны преподнесли Адольфу Гитлеру на день рождения?",Кремль
125,За какую команду гонок Формулы-1 выступает Михаил Шумахер?,Mercedes GP
126,"Какая из этих пород уток является яичной, а не мясной? ",Индийские бегуны
127,В каком году советские войска одержали победу в Курской битве?,1943
128,Кто изображен на правом плече Марадоны?,Че Гевара
129,Что не является знаком препинания?,Твердый знак
130,Растворитель для акварельных красок?,Вода
131,Что такое сруб?,Деревянное строение
132,Что не является кисломолочным продуктом?,Майонез
133,Что такое дельта реки?,Устье
134,Машинка для выравнивания грунта,скрепер
135,Сообразительность?,сметка
136,Какой из этих цветов не относится к тёплым?,Синий
137,Цветы какого из этих растений не голубого цвета?,Лютик
138, Какой статус имело объединение Советских Социалистических Республик?, Содружество
139,в каком году родился и умер А.С.Пушкин,26 мая 1799-29 января 1837
140,"Что означает слово ""бедуин"" на арбском языке?",Обитатели пустыни
141,"На какой вопрос никогда нельзя правда ответить ""Да""?",Спишь
142, Небольшие скалистые острова у невысоких берегов морей,шхерыы
143,Кто стал президентом российской федерации в 2012 году?,Путин
144,BanTis,фирма
145,"Какое воинское звание было у Хозе в опере ""Кармен""",Сержант
146,"Где Николай Чернышевский написал свой роман ""Что делать?""",В тюрме
147,Ворот пиджака портной начинает отмерять с...,7 позвонка
148,Год основания группы Rammstein,1994
149,Фамилия вокалиста Linkin Park,Беннинтгон
150,Сколько атомов кислорода содержится в молекуле озона?,3
151,Сколько горошин войдут в стакан ?,горшины не ходят
152,Много людей сопровождают в последний путь своего родственника/знакомого. Как это называется?,похороны
153,Какому коню в зубы не смотрят?,Дарёному
154,Доброкачественная опухоль надпочечников,феохромацитома
155,Уровень материнской смертности определяется как число погибших матерей на:,100 000 живорожденных
156,В каком году родилась Селена Гомес?,В 1992 году.
157,На какой реке стоит город Саратов?,Волга
158,"За что тянул себя барон Мюнхгаузен, чтобы выбраться из тресины?",за волосы
159,Сколько родных братьев и сестёр было у Рона?,6
160,В какой из этих столиц союзных республик раньше всего появилось метро?,Тбилиси
161,В форме какого животного обычно делают копилки для монет?,Свинья
162,На окошке сидит кошка всё как у кошки но не кошка.,кот
163,В каком образе бог Вишну не появлялся на земле?,Слона
164,"Как заканчивается выражение ""Врет как...""?",Сивый мерин
165,Какое устройство применяли во время инквизиции?,испанский сапог
166,Какой из этих регионов - не на территории Италии?,Савойя
167,Как по-научному называется питьевой спирт?,Этанол
168,Какая из этих премий впоследствии была переименована в Государственную премию СССР?,Сталинская
169,В какой области науки проявились выдающиеся способности Софьи Ковалевской?,Математика
170,Какую из этих опер написал Моцарт?,"""Свадьба Фигаро"""
171,"Какое из этих прозаических произведений, А.С.Пушкин написал от женского имени?","""Рославлев"""
172,Из какого меxа сделаны шапки королевскиx гвардейцев Великобритании?,Медвежий
173,"Назовите вслед за Н. В. Гоголем вторую беду России, кроме дорог ?",Дураки
174,Как иначе называют гевею?,резиновое дерево
175,Что у моряков называется камбузом?,Кухня
176,Как звали знаменитого мореплавателя Кука?,Джеймс
177,Как звали прославленного английского флотоводца Нельсона?,Горацио
178,Чей бюст созерцает Аристотель на портрете Рембрандта?,Гомера
179,"Какие цветы распускаются в парке ""Чаир""?",Розы
180,Из какого злака получают манную крупу?,пшеница
181,Какая террористическая организация похитила и убила премьер-министра Италии Альдо Моро?,Красные бригады
182,"Футболист какого амплуа изобрёл «удар скорпиона», отбив мяч в прыжке пятками?",вратарь
183,Как называется группа из пяти фигурок - официальный талисман Олимпийских игр в Пекине?,"""Дети удачи"""
184,Главный герой какого романа Ф.М. Достоевского мечтал стать Ротшильдом?,Подросток
185,Кто из этих великих российских архитекторов был ярким представителем стиля барокко?,Растрелли
186,Какой из этих химических элементов был открыт в России?,Рутений
187,"Как называется надпись на лицевой или оборотной стороне монеты, медали?",Легенда
188,Какое кодовое название было у первого термоядерного взрывного устройства?,Майк
189,Какой пистолет Остап Бендер обещал дать Кислярскому в романе «Двенадцать стульев»?,парабеллум
190,"Кто написал текст российского гимна «Боже, царя храни»?",Василий Жуковский
191,Кто  добился упразднения ордена тамплиеров в 1312 году?,Филлип IV
192,"Какой чин имел Лукаш, у которого бравый солдат Швейк был денщиком?",Поручик
193,"Какая из этих команд собаке, означает ""смирно""?",Тубо!
194,"Сколько фишек надо поставить подряд в линию, чтобы одержать победу в рэндзю?",5
195,Какой крепёжный не имеет резьбы?,шплинт
196,На чём рисуют специалисты по латте-арт?,На кофейной пенке
197,Кому в пожизненное пользование была предоставлена скрипка работы Антонио Страдивари?,В. Спивакову
198,Что несколько лет назад обнаружил в Мёртвом море израильский учёный Соломон Вассер?,грибы
199,Какой стране принадлежат Шантарские острова?,Россия
200,Назовите имя и отчество морганатического супруга императрицы Елизаветы Петровны графа Разумовского,Алексей Григорьевич
201,"""Заморская провинция"" какой страны до самого последнего времени существовала на территории Китая?",Португалия
202,Героя романа какого из этих писателей звали Ловеласом?,С. Ричардсон
203,Какая олимпийская дистанция плавания самая длинная?,1500 м
204,Какое животное изображено на гербе Челябинска,Верблюд
205,Какая из этих археологических культур относится к мезолиту?,Азильская
206,Кто из великих художников Возрождения расписывал Сикстинскую капеллу Ватикана?,Микеланджело
