772,Как назывался универсальный океан окружающий суперконтинет Земли (Панагею) 225 миллионов лет назад?,Панталасса
773,"В каком городе происходит действие повести Марка Твена ""Принц и нищий""?",Лондон
774,Какой русский князь осадил столицу Византийской империи и наложил на империю контрибуцию?,Олег Вещий
775,На гербе какого государства изображена вымершая к настоящему времени птица дронт?,Маврикий
776,"Место, где река впадает в море, называется...",Устье
777,Какое название дали Сенатской площади в Санкт-Петербурге в 1782 году?,Петровская
778,Кто стал чемпионом мира в 1999 году в автогонках Формула-1?,Хаккинен
779,На каком языке были написаны мемуары Екатерины II?,На французском
780,"Где действовали суровые законы, получившие впоследствии название ""драконовские""?",Древние Афины
781,"Известно, что в кириллице многие буквы имели и цифровое значение. Чему равна буква К (како)?",20
782,Какие из перечисленных тканей тела человека обладают наибольшей электропроводностью?,Мышечные
783,В какой области получил нобелевскую премию У. Черчиль?,Литература
784,"Какой район Парижа Пуччини назвал в одной из опер ""богемной"", популяризировав понятие художественной богемы?",Латинский квартал
785,"Режиссер легендарного фильма ""Троя""?",Вольфганг Петерсен
786,Чем в комедии Грибоедова «Горе от ума» Молчалин объясняет необходимость «зависеть от других»?,Низким чином
787,Как звали доблестного рыцаря Айвенго?,Уилфред
788,Как называется кабинет Петра Первого в большом дворце в Петергофе?,Дубовый кабинет
789,"Автор текста песни ""Я московский озорной гуляка""?",Есенин
790,"Какой император в своей канцелярии учредил ""Третье отделение""?",Николай l
791,Какой город является столицей Удмуртской республики?,Ижевск
792,"Кто из этих асов авиации является единственным в мире летчиком, совершившим четыре воздушных тарана?",Ковзан
793,Благодаря чему попали в Книгу рекордов Гиннеса странствующий альбатрос и африканский марабу?,Размах крыльев
794,Под каким псевдонимом нам известна Мария Магдалена фон Лош?,Марлен Дитрих
795,Что хотел выменять Иван Иванович Перерепенко у Ивана Никифоровича Довгочхуна?,Ружьё
796,Что собирает девушка на картине Карла Брюллова «Итальянский полдень»?,Виноград
797,Кто придумал Бременских музыкантов?,Братья Гримм
798,"Название какого мясного блюда в переводе на русский означает просто ""Жареная говядина""?",Ростбиф
799,Где в основном живут копты?,Египет
800,Киренаика - это историческая область какой страны?,Ливия
801,Какое произведение есть у Ги де Мопассана?,Пышка
802,"В каком городе расположен музей ""Прадо""?",Мадрид
803,"Назовите автора романа ""Капитан Фракасс"".",Теофил Готье
804,Как называлась частная гимнастическая школа в Древней Греции для обучения детей 12-16 лет?,Палестра
805,Кто из чемпионов мира по шахматам первой половины 20 века навсегда остался непобежденным?,Алёхин
806,Что из этого не является инструментом чертежника?,Штангенциркуль
807,"Куда заезжает водитель, паркуя свой автомобиль?",В карман
808,"Что греки называли ""водяным вором"" - клепсидрой?",Водяные часы
809,Какая страна владеет островом Кюрасао?,Нидерланды
810,Где находится Танталова пещера?,Австрия
811,"К какой из знаменитых поп-групп успех пришел после победы в конкурсе Евровидение ее песни ""Ватерлоо""?",ABBA
812,Сколько раз Франклин Рузвельт избирался на пост президента США?,Четыре
813,Какое масло должно составлять основу церковного елея?,Оливковое
814,Какой небесный объект имеет размер в диаметре 864 000 миль?,Солнце
815,Какое из этих зданий Петербурга расположено не на набережной?,Большой Гостиный Двор
816,На каком языке в романе «Двенадцать стульев» не просил подаяния Киса Воробьянинов?,На английском
817,"Как называется короткий открытый жилет испанских тореадоров, а также шляпа, надевавшаяся к нему?",Болеро
818,"С названием какого города этимологически связано название ""джинсы""?",Генуя
819,"Как назывался четырехмачтовый барк ""Крузенштерн"" до его передачи СССР после второй мировой войны?",Падуя
820,"Кто из британских принцев, по существующему положению, наследует корону?",Чарльз
821,Как официально называется собор Василия Блаженного?,Покровский
822,Крест какого святого символизирует Ирландию на флаге Великобритании?,Патрика
823,Откуда пришло во многие языки мира слово &quot;табу&quot;?,Полинезия
824,"Что процитировал Роберт Оппенгеймер, когда сказал ""Я — Смерть, Разрушитель Миров""?",Бхагават-Гиту
825,Кто из этих российских императоров умер своей смертью?,Александр III
826,Как греки сами называют свою страну?,Эллада
827,Какого воинского звания не носил Юрий Гагарин?,капитан
828,Сколько детей у королевы Елизаветы II (английской)?,Четверо
829,Как называется балет Дмитрия Шостоковича на производственную тематику?,«Болт»
830,Сколько зубов у улитки?,около 25000
831,Какой английский монарх скончался в 1952 году?,Георг VI
832,Кто из перечисленных здесь римских императоров правил раньше остальных?,Тиберий
833,Кто в годы второй Мировой войны на собственном катере выслеживал немецкие подводные лодки?,Хемингуэй
834,Что внутри упаковки с надписью «ядрица»?,Гречка
835,Сколько джокеров в стандартной карточной колоде в 54 листа?,Два
836,"Кто, заботясь о будущем, скомандовал перед сражением: ""Ослов и ученых на середину!""?",Наполеон
837,Как в старину называли галерку?,Раёк
838,"Какой футболист в 2004 году получил ""Золотой мяч""?",Андрей Шевченко
839,"Кто попался на крючок герою повести ""Старик и море""?",Марлин
840,Какое млекопитающее из обитающих у нас в стране самую большую часть своей жизни проводит во сне?,Ёж
841,Какая из этих модных новинок появилась у советских граждан позже всего?,Рубашка поло
842,Какой казацкий военный чин имел Емельян Пугачев?,Хорунжий
843,"Какое молодёжное движение избрало своим девизом фразу «Занимайтесь любовью, а не войной»?",Хиппи
844,Сколько драхм содержится в одной унции в аптекарской системе исчисления?,8
845,Чему пел песню Максим Горький в «Песне о Соколе»?,Безумству храбрых
846,Как называлась самая высокая горная вершина на территории СССР?,Пик Коммунизма
847,Какое слово переводится с греческого как «склад»?,Аптека
848,Что такое эвфемизм?,Воздержание от неподобающих слов
849,Какое прозвище было у Ивана IV?,Грозный
850,Какое из этих зданий было построено раньше других?,Храм Василия Блаженного
851,Какие из этих ниток и нитей - металлические?,Канитель
852,Какое животное в индуизме считается священным?,Корова
853,"Как автомобилисты называют конструкцию из труб и стержней, которая крепится перед бампером внедорожников?",Кенгурятник
854,На флаге какого из этих государств отсутствует жёлтый цвет?,Эстония
855,"Какого цвета скатерть на картине ""Тайная вечеря"" Да Винчи?",Белая
856,К какой величине ближе скорость звука в воздухе?,330 м/сек
857,Что разрушали луддиты?,Машины
858,Какой древнегреческий бог олицетворял западный ветер?,Зефир
859,"С какими животными сражался на арене главный герой фильма 2000 г. ""Гладиатор""?",Тигры
860,Как в древности на Руси называли Каспийское море?,Хвалынское
861,Чем в геральдике лев отличается от леопарда?,Поворотом головы
862,Из за какого слова поссорились Иван Иванович и Иван Никифорович?,Гусак
863,Какая планета при наблюдении с Земли самая яркая?,Венера
864,Как звали героя романа английского писателя Сэмюэла Ричардсона «Кларисса»?,Ловелас
865,Какое созвездие изображено на флаге штата Аляска?,Большая Медведица
866,Какая из этих лесных ягод считается несъедобной?,Воронец
867,"Какая группа записала музыкальный альбом ""Актриса Весна""?","""ДДТ"""
868,Кто автор текста песни «Миллион алых роз»?,Вознесенский
869,Какой подводной лодкой командовал в одной из своих ролей актёр Пётр Вельяминов?,"""Счастливая Щука"""
870,Какую реку древние греки называли Танаис?,Дон
871,Кто был первым лауреатом Нобелевской премии по физике?,Рентген
872,Какая из этих муз - покровительница лирической поэзии и музыки?,Эвтерпа
873,Кто из перечисленных не надзирал за строительством бастионов Петропавловской крепости?,Ф.Я.Лефорт
874,Что усовершенствовал в середине XIX века Элиша Грейвс Отис?,лифт
875,Какой прибор пришёл на смену стетоскопу?,Фонендоскоп
876,В каком году родился известный французский писатель Жюль Верн?,1828
877,Какие предприятия составляли основу промышленной империи Саввы Морозова?,Текстильные фабрики
878,"Какой роман Достоевского экранизировал в 1951 году Акира Куросава, перенеся его действие в послевоенную Японию?",«Идиот»
879,Какое максимальное число игроков может одновременно находиться на льду во время хоккейного матча?,12
880,"Какую игру придумали студенты Кембриджа, исп. коробки для сигар и пробки от шампанского?",Настольный теннис
881,К какой их этих королевских династий в Англии принадлежал Генрих VIII?,Тюдоры
882,Как называется на юге Франции низкорослые вечнозелёные заросли кустарников или полукустарников?,Гарига
883,Какого из этих святых обычно изображают с ключами от Рая?,Св. Пётр
884,Какую из этих пьес написал не Е. Л. Шварц?,"""Двенадцать месяцев"""
885,Как называется хвостовая стойка шасси самолета По-2?,Костыль
886,"Кто написал книгу ""Иудейская война""?",Иосив Флавий
887,Какое государство Европы официально именуется Великим Герцогством?,Люксембург
888,Что такое морион?,Черный кварц
889,"Что остановится, если в пассажирском вагоне дёрнуть стоп-кран?",Поезд
890,При какой императрице произошло Пугачевское восстание?,Екатерина II
891,Какое из произведений написал Л. Фейхтвангер?,Еврей Зюсс
892,"Как называется сходство по духу, образу мыслей, художественной манере и т.п.?",Конгениальность
893,Какой из этих кинофильмов снял режиссёр Федерико Феллини?,"""Джинджер и Фред"""
894,"Кем был сформулирован закон, что действию всегда есть равное противодействие?",Ньютоном
895,Как называют брата жены?,Шурин
896,Как называется кислота химическая формула которой HF?,Плавиковая
897,Кто впервые произвел удачную пересадку человеческого сердца?,К.Барнард
898,Какой из этих придворных чинов в России был ниже остальных трех до 1844 г.?,Обер-церемониймейстер
899,"Какая кличка была у собаки, принадлежавшей актеру В.Качалову, которой С.Есенин посвятил поэтические строчки?",Джим
900,Какой из этиx xищников относится к вымершим видам?,Саблезубый тигр
901,Какой язык относится к западно-славянской группе?,Польский
902,Представители какой профессии в средние века успешно заменяли врачей?,Цирюльники
903,Из какого восточного единоборства родилось современное дзюдо?,Джиу-джитсу
904,"Когда, с точностью до десятилетия, был изобретен дизельный двигатель?",1891-1900
905,Какой орех напомнил средневековым португальским морякам гримасничающую мордочку?,кешью
906,С какой из этих птиц фазана связывает биологическое родство?,Курица
907,На каких официальных турнирах матч между теннисистками идет до трех побед (т.е. может состоять из 5-ти сетов)?,Ни на каких
908,"Сумма очков на бильярдных шарах 130 (1=11). До скольких очков продолжается партия в ""русскую пирамиду""?",71
909,"Русский землепроxодец, изучавший Камчатку в 1697- 1699 годаx и давший ее подробное описание.",В.В. Атласов
910,Кто в работе использует нить под названием кетгут?,Хирурги
911,На какой реке стоит город Якутск?,Лена
912,"Какое воинское звание происходит от слова ""большой""?",Майор
913,"Из какого произведения взяты строки «Бойцы поминают минувшие дни и битвы, где вместе рубились они»?",«Песнь о вещем Олеге»
914,Какое из этих слов одновременно является названием легкой хлопчатобумажной ткани?,Майя
915,В какой стране воевали между собой в 15 веке Алая и Белая Розы?,Англия
916,Какой город был построен на семи холмах?,Рим
917,В какой игре из международных соревнований присуждается звание гроссмейстера?,Бридж
918,Каких преступников Данте поместил в девятый круг ада?,предателей
919,"У кого из этих известных людей, вторая часть фамилии является псевдонимом?",Салтыков-Щедрин
920,Как называется страх игл и уколов?,Трипанофобия
921,Как называются японские комиксы?,манга
922,Какая наименьшая величина остаточной высоты рисунка протектора допускается при эксплуатации мотоцикла?,"0,8 мм"
923,"Какой персонаж Шекспира произнес ""Не действует по принужденью милость""",Порция
924,Какая планета Солнечной системы имеет самый большой период обращения вокруг Солнца?,Нептун
925,"Ареной какого клуба является знаменитый стадион ""Ноу Камп""?","""Барселона"""
926,Как японцы называют кижуча?,Серебряный лосось
927,Что держит в поднятой руке Пётр I на монументе работы Зураба Церетели?,Свиток
928,"Сколько времени в Нью-Йорке, когда в Москве наступает Новый год?",3 часа дня
929,"Какой инвентарь используют на Олимпийских играх спортсмены, соревнующиеся в хаф-пайпе?",Сноуборд
930,Кто из американских политических деятелей считается одним из изобретателей громоотвода?,Бенджамин Франклин
931,Как расшифровывается аббревиатура НЭП?,Новая экономическая политика
932,За что Владимир Высоцкий был посмертно удостоен Государственной премии СССР?,За роль Жеглова
933,Как называется кислота химическая формула которой: HClO3?,Хлорноватая
934,Кем приходилась императрица Анна Иоанновна Петру I?,Племянницей
935,Представитель какого государства победил на конкурсе «Евровидение-2005»?,Греции
936,Какой знаменитый мореплаватель основал город Петропавловск-Камчатский?,Беринг
937,"В какую страну надо отправиться, чтобы купить сделанный там настоящий персидский ковёр?",Иран
938,Чего нет у кошек острова Мэн?,хвоста
939,Какой композитор написал первую советскую рок-оперу «Орфей и Эвридика»?,Александр Журбин
940,Представители какого народа именуют себя словом «хай»?,армяне
941,"Вставьте пропущенное слово: ""Ярем он барщины … // Оброком легким заменил.""",Старинной
942,Какая птица спасла жизнь императора Китая в сказке Андерсена?,Соловей
943,Какой слои земной атмосферы самый низкий?,Тропосфера
944,"На каких самолётах летали лётчики эскадрильи ""Нормандия-Неман""?",Як-3
945,В каком месяце 1929 г. случился крах Нью-Йоркской биржи и началась Великая Депрессия?,Октябрь
946,В каком городе находится гробница пророка Мухаммеда?,Медина
947,Что послужило эталоном единицы веса драгоценных камней - карата?,Семечко
948,Разработка проекта наказания декабристов была поручена?,Сперанскому
949,Какая планета Солнечной системы имеет 27 спутников?,Уран
950,"На чьи стихи написана песня ""День Победы""?",Харитонов
951,Кто такие лангобарды?,Германское племя
952,На что пошла большая часть дубовых рощ Испании во второй половине XVI века?,на постройку кораблей
953,Что в России 19 века делали в дортуаре?,Спали
954,"Про кого не говорят, что он круглый?",шутник
955,"Как называется белый, расписанный синим фарфор, который производится в одном городе России?",Гжель
956,Для чего нужен манок?,приманивать зверей и птиц
