1524,Каких клеток больше всего в составе человеческой крови?,Эритроциты
1525,Какое оружие названо не в честь своего создателя?,базука
1526,"Флаг какого государства получится, если флаг Венгрии повернуть на 90 градусов по часовой стрелке?",Италии
1527,Как англичанин Генри Коул впервые в истории порадовал друзей в преддверии нового 1843 года?,отправил им открытки
1528,Что обычно является активным ингридиентом антиперсперанта?,Аллюминий
1529,Какой из этих романов написал не Хемингуэй?,"""Триумфальная арка"""
1530,Конь какого полководца носил кличку Маренго?,Наполеон Бонапарт
1531,К какой из этих величин (в долях кубометра) ближе всего нефтяной баррель?,"0,16"
1532,Какие боги были идентичны в религиях древних римлян и греков?,Афродита и Венера
1533,Какая из этих стран ЕЭС пока не перешла на безналичные расчеты в ЕВРО?,Великобритания
1534,Какой цвет в композиции икебаны символизирует зиму?,Чёрный
1535,В какой стране название жандармерии дал один из видов огнестрельного оружия?,Италия
1536,Флаг какой страны не красно-бело-голубой?,Израиль
1537,Кто из перечисленных поэтов окончил Академию художеств в Санкт-Петербурге?,Тарас Шевченко
1538,На какой из этих лодок издревле плавали ирландцы?,куррах
1539,Кто из этих людей был известным астрономом?,Тихо Браге
1540,Какого цвета были глаза у Эраста Петровича Фандорина?,голубые
1541,Что такое или кто такой ТУВАЛУ?,Государство
1542,"Какой головной убор был сшит не должным образом, что и послужило темой для скороговорки?",Колпак
1543,Какой из этих футбольных клубов - голландский?,"""Фейеноорд"""
1544,"Кто из этих актрис не снимался в к/ф ""Отпуск за свой счёт""?",Любовь Соколова
1545,Постановщиком какого из этих фильмов был не Сергей Эйзенштейн?,"""Земля"""
1546,Какой из этих балетов написал не Родион Щедрин?,"""Анюта"""
1547,Кто из этих советских физиков получил нобелевскую премию позже остальных?,Ландау
1548,"Какой из этих поэтов имеет в своём архиве стихотворение, не содержащее ни одного глагола?",А.А.Фет
1549,Какое из этих озер по площади самое маленькое?,Ильмень
1550,Какая из этих ярких звезд - альфа Девы?,Спика
1551,"Какой из этих замечательных фильмов был удостоен не ""Оскара"", а другой высокой награды?","""Летят журавли"""
1552,Какое из этих учебных заведений не находится в Великобритании?,Сорбонна
1553,"Кто из этих художников написал знаменитые ""Ирисы""?",Ван Гог
1554,Что из перечисленного является географической областью Шотландии?,Южное нагорье
1555,Что из этого является сортом сельди?,Залом
1556,Какая из этих рек не относится к сибирским?,Печора
1557,"Кто из этих людей основал автомобильную компанию ""Форд моторс""?",Генри Форд
1558,Какой из этих знаменитых алмазов был найден в Южной Африке в 1978 году?,"""Первая роза"""
1559,"""Какое из этиx слов не является антонимом оригинальности?""",Лекало
1560,Какой из этих мультфильмов не снимала студия Уолта Диснея?,"""Вуди Вудпекер"""
1561,"Что получается при добавлении в смесь белого вина, коньяка и шампанского свежих фруктов и сахара?",Крюшон
1562,Какой из этих женских голосов самый высокий?,Сопрано
1563,Денежной еденицей какой страны не является доллар?,Бенин
1564,Какую из этих птиц нельзя научить имитации человеческого голоса?,Соловей
1565,Кого использует апитерапевт для лечения людей?,Пчел
1566,Какой из полководцев командовал фронтами в течение наиболее длительного срока?,Конев
1567,Как называется одно из стихотворений В.Маяковского?,"""Левый марш"""
1568,Как называется комнатный цветок?,декабрист
1569,Кто из этих диктаторов правил по времени меньше остальных?,Франсуа Дювалье
1570,Как называется один из мостов Венеции?,Мост Вздохов
1571,На флаге какого из этих государств присутствует красный цвет?,Белиз
1572,Сколько лет старшему брату Уизли ? Если рону было 12.....,22
1573,На гербе какого государства нет изображения лошади?,Австралии
1574,Какая из этих стран никогда не использовала в государственном гимне тему гимна Великобритании?,Португалия
1575,Какой из этих инструментов по принципу извлечения звука является щипковым?,Клавесин
1576,Какой из этих грибов ядовитый?,говорушка восковатая
1577,Какой из этих городов не является столицей своей страны?,Касабланка
1578,Какой из этих городов расположен на реке Иртыш?,Омск
1579,Что было создано в результате пожара в Венской опере?,скорая помощь
1580,В каком из этих фильмов играл Р. Быков?,Служили два товарища
1581,Что из этого не является частью рангоута судна?,Такелаж
1582,В каком периоде динозавры не жили?,Девон
1583,Кто из этих ученых дважды был лауреатом Нобелевской премии?,Лайнус Полинг
1584,Какой фильм не связан сюжетом со Всемирным фестивалем молодёжи и студентов 1957 года в Москве?,«Весна в Москве»
1585,Какой из этих металлов обладает наибольшей плотностью?,платина
1586,Что из перечисленного называется настоящим орехом в ботанике?,Фундук
1587,Что из перечисленного не входит в тройное единство предписанное драматургам классицизмом?,Замысла
1588,Что из перечисленного не является заморским департаментом Франции?,Вануату
1589,"Какая птица, как считается, дала название меткому стрелку снайперу?",бекас
1590,В каком году Евровидение проходило в Москве?,2009
1591,Какая из этих рек не протекает по территории Белоруссии?,Дон
1592,В каком азиатском государстве нет постоянных рек?,Саудовская Аравия
1593,"""Кто из этих актеров сыграл в кино Гамлета?""",Смоктуновский
1594,Какое из этих названий российских генеральских чинов не употреблялось после 1796 г.?,Генерал-аншеф
1595,Какое насекомое начинает свою жизнь не как гусеница?,Стрекоза
1596,Какое из этих животных не способно двигать глазами?,Сова
1597,В каком городе России пока нет метро?,Пермь
1598,Какая из этих религий зародилась раньше остальных трех?,Буддизм
1599,Кто из этих хоккеистов является обладателем Национального Ордена Квебека? Кто из этих хоккеистов является обладателем Национального Ордена Квебека?,Марио Лемье
1600,Какая из этих социалистических стран не производила собственных легковых автомобилей?,Венгрия
1601,"Какой из этих полнометражных мультфильмов создан в США, а не у нас?","""Золушка"""
1602,Племянник какого из этих писателей был выдающимся актером?,А. П. Чехов
1603,Кто из этих древних правителей был польским королем?,Стефан Баторий
1604,Какое из этих слов написано здесь неправильно?,Корелляция
1605,Кто из этих кошачьих имеет не втягивающиеся когти?,Гепард
1606,"Как известно, харит (граций) было три. Кто тут четвертый ""лишний""?",Клио
1607,Какой из этих городов не является прибрежным Каспийскому морю?,Адлер
1608,Какое из этих слов не является названием промысловой рыбы?,Сарсуэла
1609,"Название какого блюда само говорит знатоку иностранных языков, что оно приготовлено из многих элементов?",компот
1610,Какое из этих государств - не королевство?,Исландия
1611,Кто из этих великих ученых родился раньше остальных?,Декарт
1612,Какой из этих витаминов по-другому называется РЕТИНОЛ?,А
1613,Какой из этих танцев - не польского происхождения?,Полька
1614,Как по-другому называется электрическая дуга?,Вольтова
1615,Какая из этих букв всегда обозначает твердый звук?,ц
1616,"На сцену какого театра Михаил Ефремов вышел еще мальчиком в спектакле «Уходя, оглянись»?",МХАТ
1617,"Какой богине принадлежала керинейская лань, которую изловил Геракл?",Артемиде
1618,Какая буква русского алфавита обозначается в шрифте Брайля одной выпуклой точкой?,А
1619,"Во что заяц играл с белками в новогодней сказке Маршака ""Двенадцать месяцев""?",Горелки
1620,Что такое «рыбацкий штык»?,морской узел
1621,Шахматист с какой фамилией в 1963 году стал чемпионом мира?,Петросян
1622,Какой европейский народ не относится к ретороманцам?,Фризы
1623,На каком языке традиционно отдают команды животным в цирке?,Французкий
1624,Что такое гуммиарабик?,Клей
1625,"Кто из этих классиков - автор романа ""Подросток""?",Ф. М. Достоевский
1626,Какой из этих городов - столица Нигерии:,Абуджа
1627,Какой из этих балетов не оформлял Пабло Пикассо?,''Агон''
1628,Какую из этих пьес написал А. В. Сухово-Кобылин?,"""Дело"""
1629,"Какое из этих слов писалось и до реформы русского языка через Е, а не через ЯТЬ?",Пест
1630,В какой из этих стран официальный язык - французский?,Гаити
1631,Где устанавливают спинакер?,на парусной яхте
1632,У какого футбольного клуба НЕ фиолетовые цвета команды?,Тоттенхэм Хотспур
1633,Какой из перечисленных витаминов содержится в рыбьем жире?,A
1634,Какие из этих вен относятся к венам мышечного типа?,Плечевая вена
1635,Какой из этих городов не является портом Балтийского моря?,Вильнюс
1636,"Кто выиграл ""турнирный"" чемпионат мира по шахматам ФИДЕ в 2000г.?",В. Ананд
1637,"В арсенале какого специалиста есть и сокол, и полутёрок?",штукатур
1638,В каком месяце происходит действие балета Чайковского «Щелкунчик»?,декабрь
1639,"Какая из перечисленных опер, написанных по произведениям Пушкина не принадлежит Чайковскому?","""Борис Годунов"""
1640,"Что произносит игрок в преферанс, отказываясь от участия в розыгрыше?",Пас
1641,Сколько минут в сутках?,1440
1642,От какого слова происходит имя Ева?,Живая
1643,Гривенник это,10 коп
1644,Какой из этих судов не является промысловым рыболовным?,Тендер
1645,На территорию какого из этих государств пустыня Кызылкум не заходит?,Афганистан
1646,Какой российский император заслужил прозвище Палкин?,Николай I
1647,"От чего в 1890 году законодательно отказалась Юта, чтобы стать полноправным штатом США?",Многожёнство
1648,В каком жанре Людвиг ван Бетховен написал «Творения Прометея»,балет
1649,Чему равен корень четвёртой степени из 625?,5
1650,Какое из этих больших озёр находится в Европе?,Балатон
1651,На какой реке стоит город Обнинск?,Протва
1652,Назовите столицу Суринама.,Парамарибо
1653,"Какую меру жидкости на Руси называли ""кружка""?",Штоф
1654,"Спутником какой планеты является Титан, превосходящий по размерам планету Меркурий?",Сатурна
1655,Какую спортивную игру начинают не с подачи?,Баскетбол
1656,"""В состав какого сплава не входит медь?""",мегапир
1657,Как называли мультсериал про корову и кота?,"Корова, кот и океан"
1658,"Какой из этих городов не является центром одного из федеральных округов, созданных указом В. В. Путина?",Красноярск
1659,Какое из этих животных накапливает к зиме жир в хвосте?,Бобер
1660,"От кого Нильс спас гуся, завоевав доверие диких гусей в сказке С.Лагерлёф?",От лисы
1661,Что из перечисленного Россия не экспортирует?,Горячая вода
1662,Что означает футбольный термин ''аут''?,Мяч вне поля
1663,"Какая птица, согласно поговорке, не позволяет учить себя яйцам?",Курица
1664,Какое из этих названий жетелей разных городов России - неправильное?,Курчанин
1665,Где расположена штаб-квартира Совета Европы?,Страсбург
1666,Какой из этих подмосковных городов - самый крупный по населению?,Мытищи
1667,В каком архитектурном стиле построено здание Большого театра в Москве?,Классицизм
1668,Какая башня Московского Кремля располагается между Царской и Сенатской?,Спасская
1669,Какая из этих рек - самая короткая?,Днестр
1670,"Что такое ""киноа""?",Зерновая культура
1671,"Чем на Руси становились вершки, если их набиралось шестнадцать?",Аршин
1672,Назовите крупнейшее озеро Африки?,Виктория
1673,Разновидностью какого прибора является анероид?,барометр
1674,Как написать правильно?,Потчевала яствами
1675,Какой из этих полнометражных американских мультфильмов создан не на студии Диснея?,"""Анастасия"""
1676,Собака какой породы участвует в торжественных церемониях перед Букингемским дворцом?,ирландский волкодав
1677,Какой город является столицей Северной Ирландии?,Белфаст
1678,"У лошадей какой масти из этих четырёх хвост и грива светлые, а не чёрные?",Игреневый
1679,"Соцветие какого растения ботаники не назовут ""кистью""?",Рябина
1680,Какая из этих кошек является длинношёрстной?,Персидская
1681,"Какое из этих имён произошло от греческого слова ""девственный""?",Парфён
1682,Какая вена входит в правое предсердие?,Верхняя полая
1683,Какая из этих марок пива - ирландская?,"""Гиннесс"""
1684,Название какого из этих видов сооружений произошло от одного из семи чудес света?,Мавзолей
1685,"Как называется застежка-украшение на ожерелье, альбоме и др.?",Фермуар
1686,Какой из этих романов написал не Ги де Мопассан?,"""Дамское счастье"""
1687,К какому фильму не писал музыку Эннио Морриконе?,«Большой Лебовски»
1688,Какое из этих названий не является синонимом трех остальных?,Ягуар
1689,Что не предназначено для нанесения линий?,рейсинг
1690,У какого дерева листья осенью зелёные?,Ольха
1691,Какой предмет мебели не упоминается в пароле для связи в фильме «Подвиг разведчика»?,табурет
1692,Какое прозвище в народе получила простейшая магнитола?,«балалайка»
1693,Что используют в работе воздушные гимнасты?,трапецию
1694,На марках какой страны название страны отсутствует?,Англия
1695,На какой формат изображения перешёл с 1 июня 2011 года Первый канал российского телевидения?,16:9
1696,На какой остров был построен мост из Владивостока в рамках программы подготовки города к проведению саммита АТЭС?,О. Русский
1697,Какой из этих создающих изображение приборов не подразделяется на черно-белые и цветные?,Фотоаппарат
1698,Столица какой африканской страны еще не так давно называлась Лагос?,Нигерия
1699,Кто упомянут в песне «Тачанка»?,лётчики
1700,Какого персонажа нет в пьесе Метерлинка «Синяя птица»?,Масло
1701,"Как называется повторяющаяся часть (мотив) рисунка (узора) на ткани, обоях и пр.?",Раппорт
1702,"Какой из этих российских орденов был ""младше"" остальных?","""Станислав 2-й степени"""
1703,Какой из этих спортивных снарядов самый лёгкий?,Копьё
1704,Какой элемент является наиболее химически активным?,фтор
1705,Какие ткани относятся к соединительным?,Костные
1706,Сколько человек в струнном квартете?,4
1707,Где в теле человека расположена плюсна?,Стопа
1708,В каком полушалочке стоит на полустаночке героиня популярной когда-то песни на стихи М. Анчарова?,В цветастом
1709,Последний танец какого из этих хореографов завершился в возрасте 96 лет?,Марта Грэм
1710,Чьим слугой был Базен?,Арамиса
1711,"Как заканчивается расхожее выражение ""Враг моего врага...""?",Мой друг
1712,Какое понятие никак не связано с числом 3?,триггер
1713,Как говорят о пустячной задаче?,плёвое дело
1714,На каком национальном инструменте хорошо играл Джордж Харрисон?,ситар
1715,Как с греческого языка переводится слово «демагог»?,вождь народа
1716,"Что, согласно договору Эйфеля с парижскими властями, должно было произойти с башней его конструкции в 1909 году?",разбор на металлолом
1717,Как по-другому называют глюкозу?,виноградный сахар
1718,Какая из карточных мастей считается самой старшей при игре в бридж?,пики
1719,В какой из этих стран нет шерифов?,Испания
1720,"Кто написал ""Неаполитанскую песенку""?",Чайковский
1721,Какая планета была открыта в 1846 году благодаря постоянному отклонению Урана от рассчитанной учёными орбиты?,Нептун
